{
  "schema_version": "solo-export-v2",
  "implementation_profile_id": "solo-pages-v2",
  "exported_at": "2026-08-23T00:00:00.000Z",
  "records": {
    "profile": {
      "schema_version": "solo-profile-v2",
      "profile_id": "profile.local",
      "display_name": "Night Technician",
      "icon_id": "cosmetic.profile.systems"
    },
    "decks": {
      "schema_version": "solo-decks-v2",
      "ruleset_version": "first-version-v2",
      "card_catalog_version": "core-card-catalog-diagnosis-v2",
      "active_deck_id": "deck.local.storage_response_v2",
      "decks": [
        {
          "deck_id": "deck.local.storage_response_v2",
          "display_name": "Storage Response Deck v2",
          "source_deck_id": "deck.core.storage_response_v2",
          "card_definition_ids": [
            "card.core.replace_raid_member",
            "card.core.replace_raid_member",
            "card.core.replace_raid_member",
            "card.core.rebuild_raid_array",
            "card.core.rebuild_raid_array",
            "card.core.rebuild_raid_array",
            "card.core.reseat_storage_cable",
            "card.core.reseat_storage_cable",
            "card.core.reseat_storage_cable",
            "card.core.raid_health_verification",
            "card.core.raid_health_verification",
            "card.core.raid_health_verification",
            "card.core.storage_detection_verification",
            "card.core.storage_detection_verification",
            "card.core.storage_detection_verification",
            "card.core.replace_raid_member",
            "card.core.replace_raid_member",
            "card.core.replace_raid_member",
            "card.core.rebuild_raid_array",
            "card.core.rebuild_raid_array",
            "card.core.rebuild_raid_array",
            "card.core.reseat_storage_cable",
            "card.core.reseat_storage_cable",
            "card.core.reseat_storage_cable",
            "card.core.raid_health_verification",
            "card.core.raid_health_verification",
            "card.core.raid_health_verification",
            "card.core.storage_detection_verification",
            "card.core.storage_detection_verification",
            "card.core.storage_detection_verification"
          ]
        }
      ]
    },
    "settings": {
      "schema_version": "solo-settings-v2",
      "starting_ticket_count": 3,
      "motion_preference": "SYSTEM",
      "drag_enabled": false,
      "preferred_bench_view": "RELEVANT"
    },
    "statistics": {
      "schema_version": "solo-statistics-v2",
      "processed_match_start_ids": [],
      "processed_match_results": [],
      "totals": {
        "matches_started": 0,
        "matches_completed": 0,
        "solo_wins": 0,
        "solo_losses": 0,
        "solo_stalemates": 0,
        "invalid_or_capped_results": 0,
        "tickets_closed": 0,
        "starting_service_points_total": 0,
        "final_service_points_total": 0,
        "lifetime_service_points_gained": 0,
        "tests": 0,
        "accepted_isolations": 0,
        "rejected_isolations": 0,
        "repairs": 0,
        "verify_attempts": 0,
        "verify_passes": 0,
        "verify_failures": 0,
        "verify_inconclusive_results": 0,
        "documentation": 0,
        "assists": 0,
        "failed_verify": 0,
        "redundant_or_superseded_actions": 0,
        "turns": 0,
        "authoritative_elapsed_seconds": 0,
        "search_uses": 0,
        "refresh_uses": 0,
        "eliminations_recorded": 0,
        "tickets_given_up": 0
      }
    }
  }
}
